{"action":{"action_id":"refund:18000021","actor":"RefundAgent","arguments":{"amount_minor":125000,"currency":"INR","payment_id":"pay_42"},"contract":{"contract_id":"contract:18000021","deadline_ms":100,"exact_count":1,"expected":{"amount_minor":125000,"currency":"INR","payment_id":"pay_42"},"predicate":"refund_processed","stability_ms":20},"idempotency_key":"consequa-refund-18000021","name":"refund","registered_at_ms":5,"trace_id":"trace:18000021"},"assessment":{"evidence_event_ids":["response_1"],"rationale":"Eligibility not met for refund due to order age exceeding 30 days","status":"unknown","time_ms":6},"events":[{"actor":null,"data":{"value":"The customer has asked the service desk to refund the payment specified in this task."},"id":"customer_request","parent_ids":[],"time_ms":0,"trace_id":"trace:18000021","type":"user_input"},{"actor":null,"data":{"value":"The account record identifies this customer as a VIP member."},"id":"vip_memory","parent_ids":[],"time_ms":1,"trace_id":"trace:18000021","type":"memory_read"},{"actor":null,"data":{"value":"The refund exception for VIP members allows an order age of 60 days or less."},"id":"vip_policy","parent_ids":[],"time_ms":2,"trace_id":"trace:18000021","type":"retrieval"},{"actor":null,"data":{"value":""},"id":"retry_instruction","parent_ids":[],"time_ms":3,"trace_id":"trace:18000021","type":"system_instruction"},{"actor":null,"data":{"value":"The service desk operates on weekdays."},"id":"distractor","parent_ids":[],"time_ms":4,"trace_id":"trace:18000021","type":"retrieval"},{"actor":"RefundAgent","data":{"model_seed":108000126,"policy":{"base_url":"http://127.0.0.1:11435","num_predict":384,"prompt_version":"refund-policy-v2","provider":"ollama","requested_model":"llama3.2:3b-instruct-q4_K_M","temperature":0.2,"timeout_seconds":180.0},"policy_reply":{"decision":{"assessment":"unknown","operation":"refund","rationale":"Eligible for refund under VIP policy, but attempts remaining are limited to 2."},"metadata":{"base_url":"http://127.0.0.1:11435","done_reason":"stop","eval_count":43,"eval_duration":5868795000,"load_duration":8853500,"local_inspection":{"capabilities":["completion","tools"],"details":{"families":["llama"],"family":"llama","format":"gguf","parameter_size":"3.2B","quantization_level":"Q4_K_M"},"endpoint":"/api/show","inspection_sha256":"917212d9b6e48988460623ab81e80c21ddf51fa3845914fe661d81e1ad7bea3c","no_declared_remote_routing":true,"requested_model":"llama3.2:3b-instruct-q4_K_M","routing_fields_present":[]},"num_predict":384,"prompt_eval_count":617,"prompt_eval_duration":6728879000,"prompt_version":"refund-policy-v2","provider":"ollama","request_payload_sha256":"85ed1a054801230b451be22068a0602f7f2a8da8adb964824eef3da57e2d3cfa","request_sha256":"7ecae54f3ec9b46b65105e3efa490aa6e4df1650880d783968f24e2e12640cbe","requested_model":"llama3.2:3b-instruct-q4_K_M","returned_model":"llama3.2:3b-instruct-q4_K_M","seed":108000126,"system_prompt_sha256":"141ab9ae275703cdbe23bd55376f40ce0069bb67a172d8af65ee852d577be6ed","temperature":0.2,"timeout_seconds":180.0,"total_duration":12621223800}},"policy_request":{"attempts_remaining":2,"context":{"customer_request":"The customer has asked the service desk to refund the payment specified in this task.","distractor":"The service desk operates on weekdays.","retry_instruction":"","vip_memory":"The account record identifies this customer as a VIP member.","vip_policy":"The refund exception for VIP members allows an order age of 60 days or less."},"responses":[],"stage":"select","task":{"amount_minor":125000,"base_refund_policy":"The standard refund rule allows a requested refund when the order is 30 days old or younger.","currency":"INR","deadline_ms":100,"horizon_ms":120,"idempotency_available":true,"order_age_days":43,"payment_id":"pay_42"}},"selected":true},"id":"refund_decision","parent_ids":["customer_request","vip_memory","vip_policy","retry_instruction","distractor"],"time_ms":5,"trace_id":"trace:18000021","type":"agent_decision"},{"actor":"RefundAgent","data":{"evidence_event_ids":["refund_decision"],"rationale":"Eligible for refund under VIP policy, but attempts remaining are limited to 2.","status":"unknown","time_ms":5},"id":"assessment_0","parent_ids":["refund_decision"],"time_ms":5,"trace_id":"trace:18000021","type":"agent_assessment"},{"actor":"RefundAgent","data":{"action_id":"refund:18000021","arguments":{"amount_minor":125000,"currency":"INR","payment_id":"pay_42"}},"id":"refund_intent","parent_ids":["refund_decision"],"time_ms":5,"trace_id":"trace:18000021","type":"action_intent"},{"actor":"RefundAgent","data":{"action_id":"refund:18000021","attempt_id":"attempt:18000021:1"},"id":"dispatch_1","parent_ids":["refund_intent"],"time_ms":5,"trace_id":"trace:18000021","type":"action_dispatch"},{"actor":null,"data":{"attempt_id":"attempt:18000021:1","provider_request_id":"req_18000021_000001","result":{"amount_minor":125000,"currency":"INR","payment_id":"pay_42","refund_id":"rf_18000021_000001","status":"processed"},"status":"success","time_ms":6},"id":"response_1","parent_ids":["dispatch_1"],"time_ms":6,"trace_id":"trace:18000021","type":"tool_response"},{"actor":"RefundAgent","data":{"model_seed":108000127,"policy":{"base_url":"http://127.0.0.1:11435","local_inspection":{"capabilities":["completion","tools"],"details":{"families":["llama"],"family":"llama","format":"gguf","parameter_size":"3.2B","quantization_level":"Q4_K_M"},"endpoint":"/api/show","inspection_sha256":"917212d9b6e48988460623ab81e80c21ddf51fa3845914fe661d81e1ad7bea3c","no_declared_remote_routing":true,"requested_model":"llama3.2:3b-instruct-q4_K_M","routing_fields_present":[]},"num_predict":384,"prompt_version":"refund-policy-v2","provider":"ollama","requested_model":"llama3.2:3b-instruct-q4_K_M","temperature":0.2,"timeout_seconds":180.0},"policy_reply":{"decision":{"assessment":"unknown","operation":"stop","rationale":"Eligibility not met for refund due to order age exceeding 30 days"},"metadata":{"base_url":"http://127.0.0.1:11435","done_reason":"stop","eval_count":41,"eval_duration":5078757000,"load_duration":5533900,"local_inspection":{"capabilities":["completion","tools"],"details":{"families":["llama"],"family":"llama","format":"gguf","parameter_size":"3.2B","quantization_level":"Q4_K_M"},"endpoint":"/api/show","inspection_sha256":"917212d9b6e48988460623ab81e80c21ddf51fa3845914fe661d81e1ad7bea3c","no_declared_remote_routing":true,"requested_model":"llama3.2:3b-instruct-q4_K_M","routing_fields_present":[]},"num_predict":384,"prompt_eval_count":687,"prompt_eval_duration":6378836000,"prompt_version":"refund-policy-v2","provider":"ollama","request_payload_sha256":"2e7530b1374f3ffd6436549c579c3cd40e879db58c7423fd7a7cef127ca7822f","request_sha256":"3f965437fb71003cfafd740912a7ef4a7daa14fc54ebc698ab6516ee8054c147","requested_model":"llama3.2:3b-instruct-q4_K_M","returned_model":"llama3.2:3b-instruct-q4_K_M","seed":108000127,"system_prompt_sha256":"141ab9ae275703cdbe23bd55376f40ce0069bb67a172d8af65ee852d577be6ed","temperature":0.2,"timeout_seconds":180.0,"total_duration":11473803500}},"policy_request":{"attempts_remaining":1,"context":{"customer_request":"The customer has asked the service desk to refund the payment specified in this task.","distractor":"The service desk operates on weekdays.","retry_instruction":"","vip_memory":"The account record identifies this customer as a VIP member.","vip_policy":"The refund exception for VIP members allows an order age of 60 days or less."},"responses":[{"attempt_id":"attempt:18000021:1","provider_request_id":"req_18000021_000001","result":{"amount_minor":125000,"currency":"INR","payment_id":"pay_42","refund_id":"rf_18000021_000001","status":"processed"},"status":"success","time_ms":6}],"stage":"after_response","task":{"amount_minor":125000,"base_refund_policy":"The standard refund rule allows a requested refund when the order is 30 days old or younger.","currency":"INR","deadline_ms":100,"horizon_ms":120,"idempotency_available":true,"order_age_days":43,"payment_id":"pay_42"}},"selected":false},"id":"response_decision_1","parent_ids":["customer_request","vip_memory","vip_policy","retry_instruction","distractor","response_1"],"time_ms":6,"trace_id":"trace:18000021","type":"agent_decision"},{"actor":"RefundAgent","data":{"evidence_event_ids":["response_1"],"rationale":"Eligibility not met for refund due to order age exceeding 30 days","status":"unknown","time_ms":6},"id":"assessment_1","parent_ids":["response_decision_1"],"time_ms":6,"trace_id":"trace:18000021","type":"agent_assessment"}],"observations":[{"as_of_ms":120,"available":true,"complete":true,"observation_id":"obs_18000021_000001","observed_at_ms":120,"records":[],"scope":{"currency":"INR","lag_ms":0,"payment_id":"pay_42"},"source":"payment_ledger"}],"responses":[{"attempt_id":"attempt:18000021:1","provider_request_id":"req_18000021_000001","result":{"amount_minor":125000,"currency":"INR","payment_id":"pay_42","refund_id":"rf_18000021_000001","status":"processed"},"status":"success","time_ms":6}],"schema_version":"0.1","trace_id":"trace:18000021","verifications":[{"attributable_effect_ids":[],"contract_id":"contract:18000021","effect_ids":[],"evidence":[{"as_of_ms":120,"details":{"available":true,"complete":true,"eligible_count":0,"expected":{"amount_minor":125000,"currency":"INR","payment_id":"pay_42"},"horizon_ms":120,"matching_count":0,"peak_matching_count":0,"records":[],"relevant_count":0,"scope":{"currency":"INR","lag_ms":0,"payment_id":"pay_42"},"watermark_ms":120},"observation_id":"obs_18000021_000001","source":"payment_ledger"}],"observed_at_ms":120,"origin":"unknown","reason":"Refund predicate is violated in an exhaustive horizon-covering snapshot","status":"violated"}]}
