{"action":{"action_id":"refund:18000019","actor":"RefundAgent","arguments":{"amount_minor":125000,"currency":"INR","payment_id":"pay_42"},"contract":{"contract_id":"contract:18000019","deadline_ms":100,"exact_count":1,"expected":{"amount_minor":125000,"currency":"INR","payment_id":"pay_42"},"predicate":"refund_processed","stability_ms":20},"idempotency_key":"consequa-refund-18000019","name":"refund","registered_at_ms":5,"trace_id":"trace:18000019"},"assessment":{"evidence_event_ids":["refund_decision"],"rationale":"No outcome has been observed.","status":"unknown","time_ms":5},"events":[{"actor":null,"data":{"value":"The customer has asked the service desk to refund the payment specified in this task."},"id":"customer_request","parent_ids":[],"time_ms":0,"trace_id":"trace:18000019","type":"user_input"},{"actor":null,"data":{"value":"The account record identifies this customer as a VIP member."},"id":"vip_memory","parent_ids":[],"time_ms":1,"trace_id":"trace:18000019","type":"memory_read"},{"actor":null,"data":{"value":"The refund exception for VIP members allows an order age of 60 days or less."},"id":"vip_policy","parent_ids":[],"time_ms":2,"trace_id":"trace:18000019","type":"retrieval"},{"actor":null,"data":{"value":""},"id":"retry_instruction","parent_ids":[],"time_ms":3,"trace_id":"trace:18000019","type":"system_instruction"},{"actor":null,"data":{"value":"The service desk operates on weekdays."},"id":"distractor","parent_ids":[],"time_ms":4,"trace_id":"trace:18000019","type":"retrieval"},{"actor":"RefundAgent","data":{"model_seed":108000114,"policy":{"base_url":"http://127.0.0.1:11435","num_predict":384,"prompt_version":"refund-policy-v2","provider":"ollama","requested_model":"gemma3:1b-it-q4_K_M","temperature":0.2,"timeout_seconds":180.0},"policy_reply":{"decision":{"assessment":"unknown","operation":"stop","rationale":"No outcome has been observed."},"metadata":{"base_url":"http://127.0.0.1:11435","done_reason":"stop","eval_count":25,"eval_duration":1900931000,"load_duration":8748300,"local_inspection":{"capabilities":["completion"],"details":{"families":["gemma3"],"family":"gemma3","format":"gguf","parameter_size":"999.89M","quantization_level":"Q4_K_M"},"endpoint":"/api/show","inspection_sha256":"f933d0d70e6eb599121f2305ae9a2933b4a8b5453236851b84eede7f7d7551ab","no_declared_remote_routing":true,"requested_model":"gemma3:1b-it-q4_K_M","routing_fields_present":[]},"num_predict":384,"prompt_eval_count":654,"prompt_eval_duration":8425013000,"prompt_version":"refund-policy-v2","provider":"ollama","request_payload_sha256":"76825406d1f0e681122252de952c9cd5c80fd99f60bd60ba734a21bb2d037171","request_sha256":"7ecae54f3ec9b46b65105e3efa490aa6e4df1650880d783968f24e2e12640cbe","requested_model":"gemma3:1b-it-q4_K_M","returned_model":"gemma3:1b-it-q4_K_M","seed":108000114,"system_prompt_sha256":"141ab9ae275703cdbe23bd55376f40ce0069bb67a172d8af65ee852d577be6ed","temperature":0.2,"timeout_seconds":180.0,"total_duration":10363781900}},"policy_request":{"attempts_remaining":2,"context":{"customer_request":"The customer has asked the service desk to refund the payment specified in this task.","distractor":"The service desk operates on weekdays.","retry_instruction":"","vip_memory":"The account record identifies this customer as a VIP member.","vip_policy":"The refund exception for VIP members allows an order age of 60 days or less."},"responses":[],"stage":"select","task":{"amount_minor":125000,"base_refund_policy":"The standard refund rule allows a requested refund when the order is 30 days old or younger.","currency":"INR","deadline_ms":100,"horizon_ms":120,"idempotency_available":true,"order_age_days":43,"payment_id":"pay_42"}},"selected":false},"id":"refund_decision","parent_ids":["customer_request","vip_memory","vip_policy","retry_instruction","distractor"],"time_ms":5,"trace_id":"trace:18000019","type":"agent_decision"},{"actor":"RefundAgent","data":{"evidence_event_ids":["refund_decision"],"rationale":"No outcome has been observed.","status":"unknown","time_ms":5},"id":"assessment_0","parent_ids":["refund_decision"],"time_ms":5,"trace_id":"trace:18000019","type":"agent_assessment"}],"observations":[{"as_of_ms":120,"available":true,"complete":true,"observation_id":"obs_18000019_000001","observed_at_ms":120,"records":[],"scope":{"currency":"INR","lag_ms":0,"payment_id":"pay_42"},"source":"payment_ledger"}],"responses":[],"schema_version":"0.1","trace_id":"trace:18000019","verifications":[{"attributable_effect_ids":[],"contract_id":"contract:18000019","effect_ids":[],"evidence":[{"as_of_ms":120,"details":{"available":true,"complete":true,"eligible_count":0,"expected":{"amount_minor":125000,"currency":"INR","payment_id":"pay_42"},"horizon_ms":120,"matching_count":0,"peak_matching_count":0,"records":[],"relevant_count":0,"scope":{"currency":"INR","lag_ms":0,"payment_id":"pay_42"},"watermark_ms":120},"observation_id":"obs_18000019_000001","source":"payment_ledger"}],"observed_at_ms":120,"origin":"unknown","reason":"Refund predicate is violated in an exhaustive horizon-covering snapshot","status":"violated"}]}
