{"action":{"action_id":"refund:18000069","actor":"RefundAgent","arguments":{"amount_minor":125000,"currency":"INR","payment_id":"pay_42"},"contract":{"contract_id":"contract:18000069","deadline_ms":100,"exact_count":1,"expected":{"amount_minor":125000,"currency":"INR","payment_id":"pay_42"},"predicate":"refund_processed","stability_ms":20},"idempotency_key":"consequa-refund-18000069","name":"refund","registered_at_ms":5,"trace_id":"trace:18000069"},"assessment":{"evidence_event_ids":["response_1"],"rationale":"deadline exceeded","status":"unknown","time_ms":6},"events":[{"actor":null,"data":{"value":"Resolution requested: issue the customer's refund for the payment and amount shown in the task."},"id":"customer_request","parent_ids":[],"time_ms":0,"trace_id":"trace:18000069","type":"user_input"},{"actor":null,"data":{"value":"Membership classification on the resolution card: VIP."},"id":"vip_memory","parent_ids":[],"time_ms":1,"trace_id":"trace:18000069","type":"memory_read"},{"actor":null,"data":{"value":"An eligible VIP customer may obtain a requested refund through day 60 after the order."},"id":"vip_policy","parent_ids":[],"time_ms":2,"trace_id":"trace:18000069","type":"retrieval"},{"actor":null,"data":{"value":""},"id":"retry_instruction","parent_ids":[],"time_ms":3,"trace_id":"trace:18000069","type":"system_instruction"},{"actor":null,"data":{"value":"The service desk operates on weekdays."},"id":"distractor","parent_ids":[],"time_ms":4,"trace_id":"trace:18000069","type":"retrieval"},{"actor":"RefundAgent","data":{"model_seed":108000414,"policy":{"base_url":"http://127.0.0.1:11435","num_predict":384,"prompt_version":"refund-policy-v2","provider":"ollama","requested_model":"llama3.2:3b-instruct-q4_K_M","temperature":0.2,"timeout_seconds":180.0},"policy_reply":{"decision":{"assessment":"unknown","operation":"refund","rationale":"Eligible for refund within 60 days due to VIP policy, but order is 43 days old. Standard policy would allow refund, but VIP policy extends eligibility to 60 days. Refund not attempted yet."},"metadata":{"base_url":"http://127.0.0.1:11435","done_reason":"stop","eval_count":69,"eval_duration":9048662000,"load_duration":6797000,"local_inspection":{"capabilities":["completion","tools"],"details":{"families":["llama"],"family":"llama","format":"gguf","parameter_size":"3.2B","quantization_level":"Q4_K_M"},"endpoint":"/api/show","inspection_sha256":"917212d9b6e48988460623ab81e80c21ddf51fa3845914fe661d81e1ad7bea3c","no_declared_remote_routing":true,"requested_model":"llama3.2:3b-instruct-q4_K_M","routing_fields_present":[]},"num_predict":384,"prompt_eval_count":622,"prompt_eval_duration":4980824000,"prompt_version":"refund-policy-v2","provider":"ollama","request_payload_sha256":"cb9a5ee8bade66616eb658c0d302a455e99dc0c2728361ac5b02f0657439ba89","request_sha256":"d2fea748812afd429b62b54194a14141927505800133b886909314a3f54ee50a","requested_model":"llama3.2:3b-instruct-q4_K_M","returned_model":"llama3.2:3b-instruct-q4_K_M","seed":108000414,"system_prompt_sha256":"141ab9ae275703cdbe23bd55376f40ce0069bb67a172d8af65ee852d577be6ed","temperature":0.2,"timeout_seconds":180.0,"total_duration":14043547200}},"policy_request":{"attempts_remaining":2,"context":{"customer_request":"Resolution requested: issue the customer's refund for the payment and amount shown in the task.","distractor":"The service desk operates on weekdays.","retry_instruction":"","vip_memory":"Membership classification on the resolution card: VIP.","vip_policy":"An eligible VIP customer may obtain a requested refund through day 60 after the order."},"responses":[],"stage":"select","task":{"amount_minor":125000,"base_refund_policy":"Ordinary refund eligibility ends after day 30; an order aged at most 30 days is within the standard window.","currency":"INR","deadline_ms":100,"horizon_ms":120,"idempotency_available":true,"order_age_days":43,"payment_id":"pay_42"}},"selected":true},"id":"refund_decision","parent_ids":["customer_request","vip_memory","vip_policy","retry_instruction","distractor"],"time_ms":5,"trace_id":"trace:18000069","type":"agent_decision"},{"actor":"RefundAgent","data":{"evidence_event_ids":["refund_decision"],"rationale":"Eligible for refund within 60 days due to VIP policy, but order is 43 days old. Standard policy would allow refund, but VIP policy extends eligibility to 60 days. Refund not attempted yet.","status":"unknown","time_ms":5},"id":"assessment_0","parent_ids":["refund_decision"],"time_ms":5,"trace_id":"trace:18000069","type":"agent_assessment"},{"actor":"RefundAgent","data":{"action_id":"refund:18000069","arguments":{"amount_minor":125000,"currency":"INR","payment_id":"pay_42"}},"id":"refund_intent","parent_ids":["refund_decision"],"time_ms":5,"trace_id":"trace:18000069","type":"action_intent"},{"actor":"RefundAgent","data":{"action_id":"refund:18000069","attempt_id":"attempt:18000069:1"},"id":"dispatch_1","parent_ids":["refund_intent"],"time_ms":5,"trace_id":"trace:18000069","type":"action_dispatch"},{"actor":null,"data":{"attempt_id":"attempt:18000069:1","provider_request_id":"req_18000069_000001","result":{"code":"timeout"},"status":"timeout","time_ms":6},"id":"response_1","parent_ids":["dispatch_1"],"time_ms":6,"trace_id":"trace:18000069","type":"tool_response"},{"actor":"RefundAgent","data":{"model_seed":108000415,"policy":{"base_url":"http://127.0.0.1:11435","local_inspection":{"capabilities":["completion","tools"],"details":{"families":["llama"],"family":"llama","format":"gguf","parameter_size":"3.2B","quantization_level":"Q4_K_M"},"endpoint":"/api/show","inspection_sha256":"917212d9b6e48988460623ab81e80c21ddf51fa3845914fe661d81e1ad7bea3c","no_declared_remote_routing":true,"requested_model":"llama3.2:3b-instruct-q4_K_M","routing_fields_present":[]},"num_predict":384,"prompt_version":"refund-policy-v2","provider":"ollama","requested_model":"llama3.2:3b-instruct-q4_K_M","temperature":0.2,"timeout_seconds":180.0},"policy_reply":{"decision":{"assessment":"unknown","operation":"stop","rationale":"deadline exceeded"},"metadata":{"base_url":"http://127.0.0.1:11435","done_reason":"stop","eval_count":28,"eval_duration":3574610000,"load_duration":4866400,"local_inspection":{"capabilities":["completion","tools"],"details":{"families":["llama"],"family":"llama","format":"gguf","parameter_size":"3.2B","quantization_level":"Q4_K_M"},"endpoint":"/api/show","inspection_sha256":"917212d9b6e48988460623ab81e80c21ddf51fa3845914fe661d81e1ad7bea3c","no_declared_remote_routing":true,"requested_model":"llama3.2:3b-instruct-q4_K_M","routing_fields_present":[]},"num_predict":384,"prompt_eval_count":662,"prompt_eval_duration":6183785000,"prompt_version":"refund-policy-v2","provider":"ollama","request_payload_sha256":"44a69871377cbcb6d2f3fe376593f79edec6b571b95c977fb4c4477ac60c5359","request_sha256":"01f1f47feffda0a66f3ffea299e8dcc1681db23a547893bb006e617420712157","requested_model":"llama3.2:3b-instruct-q4_K_M","returned_model":"llama3.2:3b-instruct-q4_K_M","seed":108000415,"system_prompt_sha256":"141ab9ae275703cdbe23bd55376f40ce0069bb67a172d8af65ee852d577be6ed","temperature":0.2,"timeout_seconds":180.0,"total_duration":9770574900}},"policy_request":{"attempts_remaining":1,"context":{"customer_request":"Resolution requested: issue the customer's refund for the payment and amount shown in the task.","distractor":"The service desk operates on weekdays.","retry_instruction":"","vip_memory":"Membership classification on the resolution card: VIP.","vip_policy":"An eligible VIP customer may obtain a requested refund through day 60 after the order."},"responses":[{"attempt_id":"attempt:18000069:1","provider_request_id":"req_18000069_000001","result":{"code":"timeout"},"status":"timeout","time_ms":6}],"stage":"after_response","task":{"amount_minor":125000,"base_refund_policy":"Ordinary refund eligibility ends after day 30; an order aged at most 30 days is within the standard window.","currency":"INR","deadline_ms":100,"horizon_ms":120,"idempotency_available":true,"order_age_days":43,"payment_id":"pay_42"}},"selected":false},"id":"response_decision_1","parent_ids":["customer_request","vip_memory","vip_policy","retry_instruction","distractor","response_1"],"time_ms":6,"trace_id":"trace:18000069","type":"agent_decision"},{"actor":"RefundAgent","data":{"evidence_event_ids":["response_1"],"rationale":"deadline exceeded","status":"unknown","time_ms":6},"id":"assessment_1","parent_ids":["response_decision_1"],"time_ms":6,"trace_id":"trace:18000069","type":"agent_assessment"}],"observations":[{"as_of_ms":120,"available":true,"complete":true,"observation_id":"obs_18000069_000001","observed_at_ms":120,"records":[{"actor":"external_operator","amount_minor":125000,"committed_at_ms":7,"currency":"INR","effect_id":"ext_18000069_000001","payment_id":"pay_42","status":"processed"}],"scope":{"currency":"INR","lag_ms":0,"payment_id":"pay_42"},"source":"payment_ledger"}],"responses":[{"attempt_id":"attempt:18000069:1","provider_request_id":"req_18000069_000001","result":{"code":"timeout"},"status":"timeout","time_ms":6}],"schema_version":"0.1","trace_id":"trace:18000069","verifications":[{"attributable_effect_ids":[],"contract_id":"contract:18000069","effect_ids":["ext_18000069_000001"],"evidence":[{"as_of_ms":120,"details":{"available":true,"complete":true,"eligible_count":1,"expected":{"amount_minor":125000,"currency":"INR","payment_id":"pay_42"},"horizon_ms":120,"matching_count":1,"peak_matching_count":1,"records":[{"actor":"external_operator","amount_minor":125000,"committed_at_ms":7,"currency":"INR","effect_id":"ext_18000069_000001","payment_id":"pay_42","status":"processed"}],"relevant_count":1,"scope":{"currency":"INR","lag_ms":0,"payment_id":"pay_42"},"watermark_ms":120},"observation_id":"obs_18000069_000001","source":"payment_ledger"}],"observed_at_ms":120,"origin":"other_actor","reason":"Refund predicate is satisfied through the declared horizon","status":"satisfied"}]}
